<?xml version="1.0"?>
<WindowDocument xmlns:xsi="http://www.w3.org/2001/XMLSchema-instance" xsi:noNamespaceSchemaLocation='../../window_document.xsd'>
  <Includes>
    <!-- This include will set the default behaviour on all controls. -->
    <StyleInclude>styles.xml</StyleInclude>
  </Includes>
  <Window CssClass="window_default" SizeWidth="309" SizeHeight="88" >
    <Control>
      <MultiControlContainer>
        <Controls>
          <Label LocationX="10" LocationY="2" SizeWidth="298" SizeHeight="30" Text="Combat Simulator Project" />
          <Label CssClass="stripe" LocationX="0" LocationY="30" SizeWidth="298" SizeHeight="10" />

          <TableControlContainer LocationX="5" LocationY="45" SizeWidth="288" SizeHeight="35" CellPaddingTop="0" CellPaddingBottom="0" >
            <ColumnDefinitions>
              <Column Width="0.33"/>
              <Column Width="0.33"/>
              <Column Width="0.33"/>
            </ColumnDefinitions>
            <RowDefinitions>
              <Row Height="1"/>
            </RowDefinitions>
            <Table>
              <Row>
                <Cell>
                  <Button Id="resume" Text="Resume" />
                </Cell>
                <Cell>
                  <Button Id="options" Text="Options" />
                </Cell>
                <Cell>
                  <Button Id="quit" Text="Quit" />
                </Cell>
              </Row>
            </Table>
          </TableControlContainer>
        </Controls>
      </MultiControlContainer>
    </Control>
  </Window>
</WindowDocument>
